Sintomas,Laudo técnico,Possível Diagnóstico,Corpus Completo,Dados_tratados,Embeddings_TF
Desconforto ou Dor Abdominal; Fadiga ou Cansaço; Icterícia; Hepatomegalia; Ascite;Edema;Prurido; Confusão Mental ou Sonolência Excessiva;Vasos Sanguíneos Visíveis na Pele; Perda de Peso Involuntária;,Aumento da Ecogenicidade do Fígado (Fígado Brilhante); Dificuldade na Visualização das Estruturas Internas; Perda da Definição dos Vasos hepáticos;Aumento do Tamanho do Fígado (Hepatomegalia; Alteração Difusa ou Focal. ,Esteatose Hepática. ,Desconforto ou Dor Abdominal; Fadiga ou Cansaço; Icterícia; Hepatomegalia; Ascite;Edema;Prurido; Confusão Mental ou Sonolência Excessiva;Vasos Sanguíneos Visíveis na Pele; Perda de Peso Involuntária; Aumento da Ecogenicidade do Fígado (Fígado Brilhante); Dificuldade na Visualização das Estruturas Internas; Perda da Definição dos Vasos hepáticos;Aumento do Tamanho do Fígado (Hepatomegalia; Alteração Difusa ou Focal. ,desconfort dor abdom fadig cansac icteric hepatomegal ascit edem prur confusa ment sonolenc excess vas sanguine visivel pel perd pes involunt aument ecogenic fig fig brilh ); dificuldad visualizaca estrut intern perd definica vas hepa aument tamanh fig hepatomegal alteraca difus focal,"[0.0, 0.0, 0.0, 0.0, 0.0, 0.0, 0.057020435887281624, 0.0, 0.0, 0.0, 0.0, 0.0, 0.0, 0.0, 0.0, 0.0, 0.0, 0.0, 0.0, 0.0, 0.0, 0.0, 0.0, 0.0, 0.0, 0.0, 0.0, 0.0, 0.0, 0.0, 0.0, 0.0, 0.0, 0.0, 0.0, 0.13581553281065334, 0.0, 0.0, 0.0, 0.0, 0.0, 0.0, 0.0, 0.0, 0.0, 0.0, 0.0, 0.0, 0.0, 0.0, 0.0, 0.0, 0.0, 0.0, 0.0, 0.0, 0.0, 0.0, 0.0, 0.0, 0.0, 0.0, 0.0, 0.0, 0.0, 0.0, 0.0, 0.0, 0.0, 0.0, 0.0, 0.0, 0.0, 0.0, 0.0, 0.0, 0.0, 0.0, 0.0, 0.0, 0.13161664109860707, 0.0, 0.0, 0.0, 0.0, 0.0, 0.0, 0.0, 0.0, 0.0, 0.0, 0.15682672411087886, 0.0, 0.0, 0.0, 0.0, 0.0, 0.0, 0.0, 0.0, 0.0, 0.0, 0.0, 0.0, 0.0, 0.0, 0.0, 0.0, 0.16813321977962098, 0.0, 0.0, 0.0, 0.0, 0.0, 0.0, 0.0, 0.0, 0.0, 0.0, 0.0, 0.13161664109860707, 0.0, 0.0, 0.0, 0.0, 0.0, 0.0, 0.0, 0.0, 0.0, 0.0, 0.0, 0.0, 0.0, 0.0, 0.0, 0.0, 0.0, 0.0, 0.0, 0.0, 0.0, 0.0, 0.0, 0.0, 0.0, 0.0, 0.0, 0.0, 0.0, 0.0, 0.0, 0.0, 0.0, 0.0, 0.0, 0.0, 0.0, 0.0, 0.0, 0.0, 0.0, 0.0, 0.0, 0.0, 0.0, 0.0, 0.0, 0.0, 0.0, 0.0, 0.0, 0.0, 0.0, 0.0, 0.0, 0.0, 0.0, 0.0, 0.0, 0.0, 0.0, 0.0, 0.0, 0.0, 0.0, 0.0, 0.15924036649051304, 0.0, 0.0, 0.0, 0.0, 0.0, 0.0, 0.0, 0.0, 0.0, 0.0, 0.0, 0.0, 0.0, 0.0, 0.0, 0.0, 0.0, 0.0, 0.0, 0.0, 0.0, 0.0, 0.0, 0.19575694517152695, 0.0, 0.0, 0.0, 0.0, 0.0, 0.0, 0.0, 0.0, 0.0, 0.13161664109860707, 0.0, 0.0, 0.0, 0.0, 0.0, 0.0, 0.0, 0.0, 0.0, 0.0, 0.0, 0.0, 0.0, 0.0, 0.0, 0.0, 0.0, 0.0, 0.11046971948711383, 0.1243506509032312, 0.0, 0.0, 0.0, 0.0, 0.0, 0.0, 0.0, 0.0, 0.0, 0.0, 0.0, 0.0, 0.0, 0.0, 0.0, 0.0, 0.0, 0.0, 0.0, 0.0, 0.0, 0.0, 0.0, 0.0, 0.04924676224500512, 0.0, 0.0, 0.0, 0.0, 0.0, 0.0, 0.0, 0.0, 0.098423037296041, 0.0, 0.0, 0.0, 0.1243506509032312, 0.0, 0.0, 0.0, 0.0, 0.0, 0.0, 0.0, 0.0, 0.0, 0.0, 0.0, 0.0, 0.0, 0.0, 0.0, 0.0, 0.0, 0.0, 0.0, 0.0, 0.0, 0.0, 0.0, 0.0, 0.0, 0.0, 0.0, 0.0, 0.0, 0.0, 0.0, 0.0, 0.0, 0.12781828151811947, 0.0, 0.0, 0.0, 0.0, 0.0, 0.0, 0.0, 0.0, 0.0, 0.0, 0.0, 0.12116073996020148, 0.0, 0.0, 0.0, 0.0, 0.0, 0.0, 0.0, 0.09203296393426359, 0.0, 0.0, 0.0, 0.0, 0.0, 0.0, 0.0, 0.0, 0.45592312888541153, 0.0, 0.0, 0.0, 0.0, 0.0, 0.0, 0.0, 0.0, 0.0, 0.15924036649051304, 0.0, 0.0, 0.0, 0.0, 0.0, 0.0, 0.0, 0.0, 0.0, 0.0, 0.0, 0.0, 0.0, 0.0, 0.0, 0.0, 0.0, 0.0, 0.0, 0.0, 0.0, 0.0, 0.0, 0.0, 0.0, 0.0, 0.0, 0.0, 0.0, 0.0, 0.0, 0.0, 0.0, 0.0, 0.0, 0.0, 0.0, 0.0, 0.0, 0.0, 0.11545779761412327, 0.2810189887754301, 0.0, 0.0, 0.0, 0.0, 0.0, 0.0, 0.0, 0.0, 0.0, 0.0, 0.0, 0.0, 0.0, 0.0, 0.0, 0.0, 0.0, 0.0, 0.0, 0.0, 0.0, 0.0, 0.0, 0.0, 0.0, 0.0, 0.0, 0.0, 0.0, 0.0, 0.0, 0.0, 0.0, 0.08783407222221731, 0.0, 0.0, 0.0, 0.0, 0.0, 0.0, 0.0, 0.0, 0.0, 0.0, 0.0, 0.0, 0.0, 0.0, 0.0, 0.0, 0.0, 0.0, 0.0, 0.0, 0.0, 0.0, 0.0, 0.0, 0.0, 0.0, 0.0, 0.0, 0.0, 0.0, 0.0, 0.0, 0.0, 0.0, 0.0, 0.13581553281065334, 0.0, 0.0, 0.0, 0.0, 0.0, 0.0, 0.0, 0.0, 0.0, 0.0, 0.0, 0.17959810168704313, 0.0, 0.0, 0.0, 0.0, 0.0, 0.0, 0.0, 0.0, 0.0, 0.0, 0.0, 0.0, 0.0, 0.0, 0.0, 0.0, 0.0, 0.0, 0.0, 0.0, 0.0, 0.0, 0.0, 0.0, 0.0, 0.0, 0.0, 0.0, 0.0, 0.0, 0.0, 0.0, 0.0, 0.0, 0.0, 0.0, 0.0, 0.0, 0.0, 0.0, 0.0, 0.0, 0.0, 0.0, 0.0, 0.0, 0.0, 0.0, 0.0, 0.0, 0.0, 0.0, 0.0, 0.0, 0.0, 0.0, 0.0, 0.0, 0.0, 0.0, 0.0, 0.0, 0.0, 0.15197437629513716, 0.0, 0.0, 0.0, 0.0, 0.0, 0.0, 0.0, 0.0, 0.0, 0.0, 0.0, 0.0, 0.0, 0.0, 0.0, 0.0, 0.0, 0.0, 0.0, 0.0, 0.0, 0.0, 0.0, 0.0, 0.0, 0.0, 0.0, 0.0, 0.0, 0.0, 0.0, 0.0, 0.0, 0.0, 0.0, 0.0, 0.0, 0.0, 0.0, 0.0, 0.0, 0.0, 0.0, 0.0, 0.0, 0.0, 0.0, 0.0, 0.0, 0.0, 0.0, 0.0, 0.0, 0.0, 0.0, 0.0, 0.0, 0.0, 0.0, 0.0, 0.0, 0.0, 0.0, 0.0, 0.0, 0.0, 0.0, 0.0, 0.0, 0.0, 0.0, 0.0, 0.0, 0.0, 0.0, 0.0, 0.0, 0.0, 0.0, 0.0, 0.14583106911889807, 0.0, 0.0, 0.0, 0.1415986238082701, 0.0, 0.0, 0.0, 0.0, 0.0, 0.0, 0.0, 0.0, 0.0, 0.0, 0.0, 0.0, 0.0, 0.0, 0.0, 0.0, 0.0, 0.0, 0.0, 0.0734870230757642, 0.0, 0.0, 0.0, 0.0, 0.0, 0.0, 0.0, 0.0, 0.0, 0.0, 0.0, 0.0, 0.0, 0.0, 0.0, 0.0, 0.0, 0.0, 0.0, 0.0, 0.0, 0.0, 0.0, 0.0, 0.0, 0.0, 0.0, 0.0, 0.0, 0.0, 0.0, 0.0, 0.0, 0.0, 0.0, 0.0, 0.0, 0.0, 0.0, 0.0, 0.14050949438771504, 0.0, 0.0, 0.0, 0.0, 0.0, 0.0, 0.0, 0.0, 0.0, 0.0, 0.0, 0.0, 0.0, 0.0, 0.0, 0.0, 0.0, 0.0, 0.0, 0.0, 0.0, 0.0, 0.0, 0.0, 0.0, 0.0, 0.0, 0.0, 0.0, 0.0, 0.0, 0.0, 0.0, 0.0, 0.0, 0.0, 0.0, 0.0, 0.0, 0.0, 0.0, 0.0, 0.0, 0.0, 0.0, 0.0, 0.0, 0.0, 0.15924036649051304, 0.0, 0.0, 0.0, 0.0, 0.0, 0.0, 0.0, 0.0, 0.0, 0.0, 0.0, 0.0, 0.0, 0.0, 0.0, 0.0, 0.0, 0.0, 0.0, 0.0, 0.0, 0.0, 0.0, 0.0, 0.0, 0.0, 0.0, 0.0, 0.0, 0.0, 0.0, 0.0, 0.0, 0.0, 0.0, 0.16813321977962098, 0.0, 0.0, 0.0, 0.0, 0.0, 0.0, 0.0, 0.0, 0.0, 0.0, 0.0, 0.0, 0.0, 0.0, 0.0, 0.11545779761412327, 0.0, 0.0, 0.0, 0.0, 0.0, 0.0, 0.0, 0.0, 0.0, 0.0, 0.0, 0.0, 0.0, 0.0, 0.0, 0.0, 0.0, 0.0, 0.0, 0.0, 0.0, 0.0, 0.0, 0.0, 0.0, 0.0, 0.0, 0.0, 0.0, 0.0, 0.0, 0.0, 0.0, 0.0, 0.0, 0.0, 0.0, 0.0, 0.0, 0.0, 0.0, 0.0, 0.0, 0.0, 0.0, 0.0, 0.0, 0.0, 0.0, 0.0, 0.0, 0.35919620337408625, 0.0, 0.0, 0.0, 0.0, 0.0, 0.0, 0.0, 0.0, 0.0, 0.0, 0.0, 0.0, 0.11545779761412327, 0.0, 0.0, 0.17959810168704313, 0.0, 0.0, 0.0, 0.0]"
Fadiga e cansaço.Fraqueza geral.Perda de apetite.Náuseas ou desconforto abdominal.Perda de peso involuntária.Icterícia;Prurido;Hematomas ou sangramentos fáceis;Hepatomegalia ou esplenomegalia;Edema;Confusão mental ou desorientação.Alterações de humor ou comportamento.Sonolência excessiva.Tremores ou movimentos involuntários (asterixis).Coma (em casos graves).Ginecomastia;Perda de pelos corporais Eritema palmar;Telangiectasias;Caquexia (perda severa de peso e massa muscular).Sangramentos graves (por insuficiência de fatores de coagulação).Insuficiência renal (síndrome hepatorrenal).,Heterogeneidade do Parênquima Hepático;Aumento da Ecogenicidade;Nódulos de Regeneração;Atrofia do Lobo Direito e Aumento do Lobo Esquerdo e/ou Caudado;Contornos Irregulares;Redução Global do Volume Hepático;Aumento do Diâmetro da leia Porta (>13 mm);Fluxo Portal Alterado;Aumento das Veias Colaterais;Trombose da Veia Porta ou Esplenomegalia;Ascite;,Cirrose Hepática,Fadiga e cansaço.Fraqueza geral.Perda de apetite.Náuseas ou desconforto abdominal.Perda de peso involuntária.Icterícia;Prurido;Hematomas ou sangramentos fáceis;Hepatomegalia ou esplenomegalia;Edema;Confusão mental ou desorientação.Alterações de humor ou comportamento.Sonolência excessiva.Tremores ou movimentos involuntários (asterixis).Coma (em casos graves).Ginecomastia;Perda de pelos corporais Eritema palmar;Telangiectasias;Caquexia (perda severa de peso e massa muscular).Sangramentos graves (por insuficiência de fatores de coagulação).Insuficiência renal (síndrome hepatorrenal). Heterogeneidade do Parênquima Hepático;Aumento da Ecogenicidade;Nódulos de Regeneração;Atrofia do Lobo Direito e Aumento do Lobo Esquerdo e/ou Caudado;Contornos Irregulares;Redução Global do Volume Hepático;Aumento do Diâmetro da leia Porta (>13 mm);Fluxo Portal Alterado;Aumento das Veias Colaterais;Trombose da Veia Porta ou Esplenomegalia;Ascite;,fadig cansac fraqu geral perd apetit nause desconfort abdom perd pes involunt icteric prur hematom sangr facel hepatomegal esplenomegal edem confusa ment desorientaca alteraco hum comport sonolenc excess trem mov involuntari asterixil ). com cas grav ). ginecomast perd corpor eritem palm telangiectas caquex perd sev pes mass muscul ). sangr grav insuficienc fat coagulaca ). insuficienc renal sindrom hepatorren ). heterogene parenqu hepa aument ecogenic nodul regeneraca atrof lob direit aument lob esquerd caud contorn irregul reduca glob volum hepa aument diametr lei port (> 13 mm ); flux port alter aument vei colater trombos vei port esplenomegal ascit,"[0.0, 0.0, 0.11862952571030437, 0.0, 0.0, 0.0, 0.034554622106388044, 0.0, 0.0, 0.0, 0.0, 0.0, 0.0, 0.0, 0.0, 0.0, 0.0, 0.0, 0.0, 0.0, 0.0, 0.0, 0.0, 0.0, 0.0, 0.0, 0.0, 0.0, 0.0, 0.0, 0.0, 0.0, 0.0, 0.0, 0.09650032663797548, 0.0, 0.06556468680373247, 0.0, 0.0, 0.0, 0.0, 0.0, 0.0, 0.0, 0.0, 0.0, 0.0, 0.0, 0.0, 0.0, 0.0, 0.0, 0.0, 0.0, 0.0, 0.0, 0.0, 0.0, 0.0, 0.0, 0.0, 0.0, 0.0, 0.06840924710835564, 0.0, 0.0, 0.0, 0.0, 0.0, 0.0, 0.0, 0.0, 0.0, 0.0, 0.0, 0.0, 0.0, 0.0, 0.0, 0.0, 0.07976023377065924, 0.0, 0.0, 0.0, 0.0, 0.11862952571030437, 0.0, 0.0, 0.0, 0.0, 0.11862952571030437, 0.1900752985665239, 0.0, 0.0, 0.0, 0.0, 0.0, 0.0, 0.0, 0.0, 0.0, 0.0, 0.0, 0.0, 0.0, 0.0, 0.0, 0.0, 0.0, 0.0, 0.0, 0.0, 0.0, 0.0, 0.0, 0.0, 0.0, 0.0, 0.0, 0.0, 0.07976023377065924, 0.0, 0.11862952571030437, 0.0, 0.0, 0.0, 0.0, 0.0, 0.0, 0.0, 0.05964477134216749, 0.0, 0.10188943284298813, 0.0, 0.0, 0.0, 0.0, 0.0, 0.0, 0.0, 0.0, 0.0, 0.0, 0.0, 0.0, 0.0, 0.0, 0.0, 0.0, 0.0, 0.0, 0.0, 0.0, 0.0, 0.0, 0.0, 0.0, 0.11862952571030437, 0.0, 0.0, 0.11862952571030437, 0.0, 0.0, 0.0, 0.0, 0.0, 0.0, 0.0, 0.0, 0.0, 0.0, 0.10883719912433466, 0.0, 0.0, 0.0, 0.0, 0.11862952571030437, 0.0, 0.0, 0.0, 0.0, 0.0, 0.0, 0.0, 0.0, 0.0, 0.0, 0.09650032663797548, 0.0, 0.0, 0.0, 0.0, 0.0, 0.0, 0.06840924710835564, 0.0, 0.0, 0.0, 0.10188943284298813, 0.0, 0.0, 0.0, 0.0, 0.0, 0.0, 0.0, 0.0, 0.0, 0.0, 0.0, 0.0, 0.0, 0.0, 0.0, 0.0, 0.0, 0.0, 0.0, 0.0, 0.0, 0.0, 0.07976023377065924, 0.0, 0.0, 0.0, 0.0, 0.0, 0.0, 0.0, 0.10188943284298813, 0.0, 0.0, 0.0, 0.0, 0.0, 0.0, 0.06996790718468954, 0.0, 0.0, 0.0, 0.0, 0.0, 0.0, 0.0, 0.0, 0.0, 0.0, 0.0, 0.0, 0.07163414360354271, 0.0, 0.0, 0.0, 0.0, 0.0, 0.0, 0.0, 0.0, 0.0, 0.0, 0.0, 0.0, 0.0, 0.0, 0.0, 0.0, 0.0, 0.0, 0.0, 0.0, 0.0, 0.0, 0.0, 0.0, 0.0, 0.05964477134216749, 0.0, 0.0, 0.0, 0.07535701338970217, 0.0, 0.0, 0.0, 0.0, 0.0, 0.0, 0.0, 0.0, 0.0, 0.0, 0.0, 0.10883719912433466, 0.0, 0.0, 0.0, 0.0, 0.0, 0.0, 0.0, 0.0, 0.18419421251403684, 0.0, 0.10188943284298813, 0.0, 0.0, 0.0, 0.0, 0.0, 0.0, 0.0, 0.0, 0.0, 0.0, 0.0, 0.0, 0.0, 0.0, 0.0, 0.0, 0.0, 0.0, 0.0, 0.0, 0.0, 0.0, 0.07342391404603317, 0.0, 0.0, 0.0, 0.0, 0.10188943284298813, 0.0, 0.0, 0.05577236021776277, 0.0, 0.0, 0.11862952571030437, 0.0, 0.0, 0.0, 0.0, 0.0, 0.0, 0.0, 0.0, 0.0, 0.0, 0.0, 0.0, 0.0, 0.0774584120135021, 0.0, 0.0, 0.0, 0.0, 0.0, 0.0, 0.0, 0.0, 0.08230477967104871, 0.0, 0.0, 0.0, 0.0, 0.0, 0.0, 0.0, 0.0, 0.0, 0.0, 0.0, 0.0, 0.0, 0.06184181701757301, 0.0, 0.10883719912433466, 0.0, 0.11862952571030437, 0.0, 0.0, 0.0, 0.0, 0.0, 0.0, 0.18419421251403684, 0.0, 0.0, 0.0, 0.0, 0.09209710625701842, 0.0, 0.0, 0.0, 0.13993581436937907, 0.08514933997567188, 0.0, 0.10188943284298813, 0.0, 0.0, 0.0, 0.06556468680373247, 0.0, 0.0, 0.0, 0.0, 0.0, 0.0, 0.0, 0.0, 0.0, 0.0, 0.0, 0.0, 0.0, 0.0, 0.0, 0.0, 0.0, 0.0, 0.0, 0.0, 0.0, 0.0, 0.0, 0.0, 0.0, 0.0, 0.11862952571030437, 0.053227814317373286, 0.0, 0.0, 0.0, 0.0, 0.0, 0.0, 0.0, 0.0, 0.0, 0.0, 0.0, 0.0, 0.0, 0.0, 0.0, 0.0, 0.0, 0.0, 0.0, 0.0, 0.0, 0.0, 0.0, 0.0, 0.0, 0.0, 0.0, 0.0, 0.0, 0.0, 0.0, 0.18419421251403684, 0.0, 0.0, 0.0, 0.0, 0.0, 0.0, 0.0, 0.0, 0.0, 0.0, 0.0, 0.0, 0.0, 0.0, 0.0, 0.10883719912433466, 0.11862952571030437, 0.0, 0.05489405073622647, 0.0, 0.0, 0.0, 0.0, 0.0, 0.0, 0.0, 0.0, 0.0, 0.0, 0.0, 0.11862952571030437, 0.0, 0.0, 0.0, 0.0, 0.0, 0.0, 0.0, 0.0, 0.0, 0.0, 0.0, 0.0, 0.0, 0.0, 0.0, 0.23725905142060874, 0.0, 0.0, 0.0, 0.0, 0.0, 0.0, 0.0, 0.0, 0.0, 0.0, 0.0, 0.0, 0.0, 0.0, 0.0, 0.0, 0.0, 0.0, 0.0, 0.0, 0.05964477134216749, 0.0, 0.0, 0.0, 0.0, 0.0, 0.0, 0.0, 0.0, 0.0, 0.0, 0.0, 0.09209710625701842, 0.0, 0.0, 0.0, 0.0, 0.0, 0.0, 0.0, 0.0, 0.0, 0.0, 0.0, 0.07976023377065924, 0.0, 0.0, 0.0, 0.0, 0.0, 0.0, 0.0, 0.10188943284298813, 0.0, 0.0, 0.0, 0.0, 0.0, 0.0, 0.0, 0.08837423647085896, 0.0, 0.0, 0.0, 0.04628004803602674, 0.0, 0.0, 0.0, 0.0, 0.09209710625701842, 0.0, 0.0, 0.0, 0.0, 0.0, 0.0, 0.0, 0.0, 0.0, 0.0, 0.0, 0.0, 0.0, 0.0, 0.0, 0.0, 0.0, 0.0, 0.0, 0.0, 0.0, 0.0, 0.0, 0.0, 0.0, 0.0, 0.10188943284298813, 0.0, 0.0, 0.0, 0.0, 0.0, 0.0, 0.0, 0.0, 0.0, 0.08837423647085896, 0.0, 0.0, 0.0, 0.0, 0.0, 0.0, 0.0, 0.0, 0.0, 0.0, 0.17161871389940495, 0.0, 0.0, 0.0, 0.0, 0.0, 0.0, 0.0, 0.0, 0.0, 0.0, 0.0, 0.0, 0.0, 0.0, 0.0, 0.0, 0.0, 0.0, 0.0, 0.08906688532252498, 0.0, 0.0, 0.0, 0.0, 0.0, 0.0, 0.0, 0.0, 0.0, 0.0, 0.0, 0.0, 0.0, 0.0, 0.0, 0.0, 0.0, 0.2895009799139264, 0.0, 0.0, 0.0, 0.0, 0.0, 0.0, 0.0, 0.0, 0.0, 0.0, 0.0, 0.0, 0.0, 0.0, 0.0, 0.0, 0.0, 0.0, 0.0, 0.0, 0.0, 0.0, 0.08514933997567188, 0.0, 0.0, 0.0, 0.0, 0.0, 0.0, 0.0, 0.0, 0.0, 0.0, 0.0, 0.0, 0.0, 0.0, 0.0, 0.11862952571030437, 0.0, 0.0, 0.0, 0.0, 0.0, 0.11862952571030437, 0.0, 0.0, 0.0, 0.0, 0.0, 0.0, 0.08514933997567188, 0.0, 0.0, 0.0, 0.0, 0.0, 0.0, 0.0, 0.0, 0.0, 0.0, 0.0, 0.0, 0.0, 0.0, 0.0, 0.0, 0.0, 0.0, 0.14684782809206634, 0.0, 0.0, 0.0, 0.0, 0.0, 0.0, 0.0, 0.0, 0.0, 0.0, 0.0, 0.0, 0.0, 0.0, 0.11862952571030437, 0.0, 0.0, 0.0, 0.0, 0.0, 0.0, 0.0, 0.0, 0.0, 0.0, 0.10188943284298813, 0.0, 0.0, 0.0, 0.0, 0.0, 0.0, 0.0, 0.0, 0.0, 0.0, 0.10188943284298813, 0.0, 0.0, 0.0, 0.0, 0.0, 0.0, 0.0, 0.0, 0.0, 0.0, 0.0, 0.0, 0.0, 0.0, 0.0, 0.0, 0.0, 0.0, 0.0, 0.10883719912433466, 0.0, 0.0, 0.0, 0.0, 0.0, 0.0, 0.0, 0.0, 0.0, 0.0, 0.0, 0.0, 0.0, 0.0, 0.0, 0.0, 0.0, 0.0, 0.0, 0.0, 0.09650032663797548, 0.10883719912433466, 0.0, 0.0, 0.0, 0.0, 0.0, 0.0, 0.0, 0.0, 0.0, 0.0, 0.0, 0.0, 0.0, 0.0, 0.0, 0.0, 0.0, 0.0, 0.0, 0.0, 0.0, 0.0, 0.0, 0.0, 0.0, 0.0, 0.0, 0.0, 0.0, 0.23725905142060874, 0.0, 0.0, 0.0, 0.0, 0.0, 0.0, 0.0, 0.0, 0.0, 0.0, 0.0, 0.0, 0.07976023377065924, 0.0, 0.0, 0.0]"
Fadiga ou cansaço extremo.Mal-estar geral.Febre baixa.Dores musculares (mialgia) ou articulares (artralgia).Náuseas e vômitos.Perda de apetite (anorexia).Dor ou desconforto no quadrante superior direito do abdômen;Diarreia ou constipação.Icterícia;Urina escura;Fezes claras ou esbranquiçadas;Prurido (coceira):HepatomegaliaConfusão mental ou desorientação;Sonolência excessiva ou coma.Hemorragias ou hematomas fáceis;Ascite e edema:,Aumento Difuso do Tamanho do Fígado (Hepatomegalia)Ecogenicidade Reduzida (Fígado Hipoecoico);Aumento da Visualização das Estruturas Vasculares;Espessamento da Vesícula Biliar;,Hepatite Aguda,Fadiga ou cansaço extremo.Mal-estar geral.Febre baixa.Dores musculares (mialgia) ou articulares (artralgia).Náuseas e vômitos.Perda de apetite (anorexia).Dor ou desconforto no quadrante superior direito do abdômen;Diarreia ou constipação.Icterícia;Urina escura;Fezes claras ou esbranquiçadas;Prurido (coceira):HepatomegaliaConfusão mental ou desorientação;Sonolência excessiva ou coma.Hemorragias ou hematomas fáceis;Ascite e edema: Aumento Difuso do Tamanho do Fígado (Hepatomegalia)Ecogenicidade Reduzida (Fígado Hipoecoico);Aumento da Visualização das Estruturas Vasculares;Espessamento da Vesícula Biliar;,fadig cansac extr mal geral febr baix dor muscul mialg articul artralg ). nause vomit perd apetit anorex ). dor desconfort quadr superi direit abdomen diarre constipaca icteric urin escur fezes cl esbranquic prur coc ): hepatomegaliaconfusa ment desorientaca sonolenc excess com hemorrag hematom facel ascit edem aument difus tamanh fig hepatomegal ecogenic reduz fig hipoeco ); aument visualizaca estrut vascul espess vesicul bili,"[0.0, 0.0, 0.0, 0.0, 0.0, 0.0, 0.0, 0.12119227583955518, 0.0, 0.0, 0.0, 0.0, 0.0, 0.0, 0.0, 0.0, 0.0, 0.0, 0.0, 0.0, 0.0, 0.0, 0.0, 0.0, 0.0, 0.0, 0.0, 0.0, 0.0, 0.0, 0.0, 0.0, 0.0, 0.0, 0.0, 0.0, 0.0, 0.0, 0.0, 0.0, 0.0, 0.0, 0.0, 0.0, 0.0, 0.0, 0.0, 0.0, 0.0, 0.0, 0.0, 0.0, 0.0, 0.14662813348998582, 0.0, 0.0, 0.0, 0.0, 0.0, 0.0, 0.0, 0.0, 0.0, 0.1039449353843538, 0.0, 0.0, 0.0, 0.0, 0.0, 0.0, 0.0, 0.0, 0.0, 0.0, 0.0, 0.0, 0.1653734854364625, 0.0, 0.1653734854364625, 0.0, 0.12119227583955518, 0.0, 0.0, 0.0, 0.0, 0.0, 0.0, 0.0, 0.0, 0.0, 0.0, 0.14440565758869373, 0.0, 0.0, 0.0, 0.0, 0.0, 0.0, 0.13993762778603183, 0.0, 0.0, 0.0, 0.0, 0.10172024300460795, 0.0, 0.0, 0.0, 0.0, 0.0, 0.0, 0.0, 0.0, 0.0, 0.0, 0.0, 0.0, 0.0, 0.0, 0.0, 0.0, 0.12119227583955518, 0.0, 0.0, 0.0, 0.0, 0.0, 0.0, 0.0, 0.0, 0.0, 0.0, 0.0, 0.0, 0.0, 0.0, 0.0, 0.0, 0.0, 0.0, 0.0, 0.0, 0.0, 0.0, 0.0, 0.0, 0.0, 0.0, 0.0, 0.0, 0.0, 0.0, 0.0, 0.0, 0.0, 0.13993762778603183, 0.0, 0.0, 0.0, 0.1653734854364625, 0.0, 0.0, 0.0, 0.0, 0.0, 0.0, 0.0, 0.0, 0.0, 0.0, 0.0, 0.0, 0.1653734854364625, 0.0, 0.0, 0.0, 0.0, 0.0, 0.0, 0.0, 0.0, 0.0, 0.0, 0.0, 0.0, 0.0, 0.0, 0.0, 0.0, 0.0, 0.0, 0.0, 0.12505860488684856, 0.0, 0.0, 0.0, 0.0, 0.0, 0.0, 0.0, 0.0, 0.0, 0.0, 0.0, 0.0, 0.0, 0.0, 0.0, 0.0, 0.0, 0.0, 0.0, 0.0, 0.0, 0.0, 0.0, 0.0, 0.0, 0.0, 0.0, 0.0, 0.0, 0.12119227583955518, 0.0, 0.0, 0.0, 0.0, 0.0, 0.0, 0.0, 0.1548166506852151, 0.0, 0.0, 0.0, 0.0, 0.0, 0.0, 0.0, 0.1039449353843538, 0.0, 0.0, 0.0, 0.11450177013560119, 0.0, 0.0, 0.0, 0.0, 0.0, 0.0, 0.0, 0.1088450281639527, 0.0, 0.0, 0.0, 0.0, 0.0, 0.0, 0.0, 0.0, 0.0, 0.0, 0.0, 0.0, 0.0, 0.0, 0.0, 0.0, 0.09069259243183672, 0.0, 0.0, 0.0, 0.0, 0.0, 0.0, 0.0, 0.0, 0.09062768799890658, 0.0, 0.0, 0.0, 0.11450177013560119, 0.0, 0.0, 0.0, 0.0, 0.0, 0.0, 0.0, 0.0, 0.0, 0.0, 0.0, 0.0, 0.0, 0.18025250833564577, 0.13428088581438336, 0.0, 0.0, 0.06941443584183142, 0.0, 0.0, 0.0, 0.0, 0.0, 0.0, 0.0, 0.0, 0.0, 0.0, 0.0, 0.0, 0.0, 0.0, 0.0, 0.11769475578301923, 0.0, 0.0, 0.0, 0.0, 0.0, 0.0, 0.0, 0.0, 0.0, 0.0, 0.0, 0.11156450807143986, 0.0, 0.1548166506852151, 0.0, 0.0, 0.1548166506852151, 0.0, 0.0, 0.08474372433723464, 0.0, 0.0, 0.0, 0.07124962752182594, 0.0, 0.1063132529403719, 0.0, 0.0, 0.27987525557206366, 0.0, 0.0, 0.0, 0.0, 0.0, 0.0, 0.0, 0.0, 0.0, 0.0, 0.0, 0.0, 0.0, 0.0, 0.0, 0.0, 0.0, 0.0, 0.0, 0.0, 0.0, 0.0, 0.0, 0.0, 0.0, 0.0, 0.0, 0.0, 0.0, 0.0, 0.09396600526476942, 0.0, 0.0, 0.0, 0.0, 0.0, 0.0, 0.0, 0.0, 0.0, 0.0, 0.0, 0.0, 0.0, 0.0, 0.0, 0.13993762778603183, 0.0, 0.0, 0.14662813348998582, 0.0, 0.12938079303478445, 0.18025250833564577, 0.0, 0.0, 0.0, 0.0, 0.0, 0.0, 0.0, 0.0, 0.0, 0.0, 0.0, 0.0, 0.0, 0.0, 0.0, 0.0, 0.0, 0.0, 0.0, 0.0, 0.09575641818912452, 0.0, 0.0, 0.0, 0.0, 0.0, 0.0, 0.0, 0.0, 0.0, 0.0, 0.0, 0.08087739528994124, 0.0, 0.0, 0.0, 0.0, 0.0, 0.0, 0.0, 0.0, 0.0, 0.0, 0.0, 0.0, 0.0, 0.0, 0.0, 0.0, 0.0, 0.0, 0.0, 0.0, 0.0, 0.0, 0.0, 0.0, 0.0, 0.0, 0.0, 0.0, 0.0, 0.0, 0.0, 0.0, 0.0, 0.0, 0.0, 0.0, 0.0, 0.0, 0.0, 0.0, 0.0, 0.0, 0.0, 0.0, 0.0, 0.0, 0.0, 0.0, 0.0, 0.0, 0.0, 0.0, 0.0, 0.0, 0.0, 0.0, 0.0, 0.0, 0.0, 0.0, 0.0, 0.0, 0.0, 0.0, 0.0, 0.0, 0.0, 0.0, 0.0, 0.0, 0.0, 0.0, 0.0, 0.0, 0.0, 0.0, 0.0, 0.0, 0.0, 0.0, 0.0, 0.0, 0.0, 0.0, 0.0, 0.0, 0.0, 0.0, 0.0, 0.0, 0.11450177013560119, 0.0, 0.0, 0.0, 0.0, 0.0, 0.0, 0.0, 0.0, 0.0, 0.0, 0.0, 0.0, 0.0, 0.0, 0.0, 0.0, 0.0, 0.0, 0.0, 0.0, 0.13993762778603183, 0.0, 0.0, 0.0, 0.0, 0.18025250833564577, 0.0, 0.0, 0.0, 0.0, 0.0, 0.0, 0.0, 0.0, 0.0, 0.0, 0.0, 0.0, 0.0, 0.0, 0.0, 0.0, 0.0, 0.0, 0.0, 0.0, 0.0, 0.0, 0.13428088581438336, 0.0, 0.0, 0.0, 0.07032056053869386, 0.0, 0.0, 0.0, 0.0, 0.0, 0.0, 0.0, 0.0, 0.0, 0.0, 0.0, 0.0, 0.0, 0.0, 0.0, 0.0, 0.0, 0.0, 0.0, 0.0, 0.0, 0.0, 0.0, 0.0, 0.0, 0.0, 0.0, 0.0, 0.0, 0.0, 0.0, 0.0, 0.0, 0.0, 0.0, 0.0, 0.0, 0.0, 0.0, 0.0, 0.0, 0.0, 0.0, 0.0, 0.0, 0.0, 0.0, 0.0, 0.0, 0.0, 0.0, 0.0, 0.06519183034847592, 0.0, 0.0, 0.0, 0.0, 0.0, 0.0, 0.0, 0.0, 0.0, 0.0, 0.0, 0.0, 0.0, 0.0, 0.0, 0.0, 0.0, 0.0, 0.0, 0.0, 0.0, 0.0, 0.0, 0.0, 0.0, 0.0, 0.0, 0.0, 0.0, 0.0, 0.0, 0.0, 0.0, 0.0, 0.0, 0.0, 0.0, 0.0, 0.0, 0.0, 0.0, 0.0, 0.0, 0.0, 0.0, 0.0, 0.0, 0.0, 0.0, 0.0, 0.0, 0.0, 0.0, 0.0, 0.0, 0.0, 0.0, 0.0, 0.0, 0.0, 0.12938079303478445, 0.0, 0.0, 0.0, 0.0, 0.0, 0.0, 0.0, 0.1088450281639527, 0.0, 0.0, 0.0, 0.0, 0.0, 0.0, 0.0, 0.0, 0.1548166506852151, 0.0, 0.0, 0.0, 0.0, 0.0, 0.0, 0.0, 0.0, 0.0, 0.0, 0.0, 0.0, 0.0, 0.0, 0.0, 0.0, 0.0, 0.0, 0.0, 0.0, 0.0, 0.0, 0.0, 0.0, 0.0, 0.0, 0.0, 0.0, 0.0, 0.0, 0.0, 0.0, 0.0, 0.0, 0.0, 0.0, 0.0, 0.0, 0.0, 0.0, 0.0, 0.0, 0.0, 0.0, 0.0, 0.0, 0.0, 0.0, 0.0, 0.0, 0.0, 0.0, 0.0, 0.0, 0.0, 0.0, 0.0, 0.0, 0.0, 0.0, 0.0, 0.0, 0.0, 0.0, 0.0, 0.0, 0.0, 0.1548166506852151, 0.0, 0.0, 0.0, 0.0, 0.0, 0.0, 0.0, 0.0, 0.0, 0.0, 0.0, 0.1039449353843538, 0.0, 0.0, 0.0, 0.1063132529403719, 0.0, 0.0, 0.0, 0.0, 0.0, 0.0, 0.0, 0.0, 0.0, 0.0, 0.0, 0.0, 0.0, 0.0, 0.0, 0.0, 0.0, 0.0, 0.0, 0.0, 0.0, 0.0, 0.0, 0.0, 0.0, 0.0, 0.0, 0.0, 0.0, 0.0, 0.0, 0.0, 0.0, 0.0, 0.0, 0.0, 0.0, 0.0, 0.0, 0.0, 0.11156450807143986, 0.0, 0.0, 0.0, 0.0, 0.0, 0.0, 0.0, 0.0, 0.0, 0.0, 0.0, 0.1653734854364625, 0.0, 0.0, 0.0, 0.0, 0.0, 0.0, 0.12119227583955518, 0.0, 0.0, 0.0, 0.0, 0.0, 0.0, 0.0, 0.1653734854364625, 0.0, 0.0, 0.07124962752182594, 0.0]"
